{
  "schema_version": "1.0.0",
  "data_mode": "fixture",
  "student_id": "student-nan-fixture",
  "private_by_default": true,
  "comparison_mode": "self_only",
  "source_boundary": "这里只看脱敏的学习过程和本人主动填写的感受；GPA、排名、门禁、消费、深夜在线、健康和人气数据都不进场。",
  "last_updated_at": "2026-07-24T11:40:00+08:00",
  "forbidden_inputs": [
    "gpa",
    "class_rank",
    "campus_access_trace",
    "payment_or_consumption",
    "night_activity",
    "device_sensor",
    "medical_or_mental_health",
    "peer_popularity",
    "paid_behavior"
  ],
  "metrics": [
    {
      "id": "metric-revision-quality",
      "label": "有依据的修订",
      "unit": "次 / 14 天",
      "definition": "查看来源后产生的可回放有效修订次数。",
      "purpose": "观察本人近期迭代行为。",
      "limitation": "次数不代表质量、能力或成绩。",
      "correction_route": "从 Replay 提交人工校对。",
      "version": "metric-r1",
      "source_types": ["learning_event", "review_object"],
      "can_correct": true,
      "comparison_mode": "self_only"
    },
    {
      "id": "metric-source-checks",
      "label": "主动核对来源",
      "unit": "次 / 14 天",
      "definition": "在答题、复习或修改前主动打开定位来源的次数。",
      "purpose": "发现需要先核对证据的任务。",
      "limitation": "打开来源不等于理解来源，不能用于排名。",
      "correction_route": "从 Evidence Pack 报告重复或错误事件。",
      "version": "metric-r1",
      "source_types": ["learning_event"],
      "can_correct": true,
      "comparison_mode": "self_only"
    },
    {
      "id": "metric-task-clarity",
      "label": "任务清晰度",
      "unit": "有 Done 与来源的任务",
      "definition": "未来七天同时具有要求、完成口径、来源和下一步的任务数。",
      "purpose": "暴露模糊要求，不把问题归咎学生。",
      "limitation": "只表示信息完整度，不表示任务容易或学生能力。",
      "correction_route": "提交课程镜像校对。",
      "version": "metric-r1",
      "source_types": ["academic_mirror", "review_object"],
      "can_correct": true,
      "comparison_mode": "self_only"
    },
    {
      "id": "metric-deadline-density",
      "label": "期限密度",
      "unit": "个 / 7 天",
      "definition": "未来七天已知截止任务数量与冲突。",
      "purpose": "提前发现任务聚集并安排缓冲。",
      "limitation": "只包含已授权且仍新鲜的任务。",
      "correction_route": "从 Academic Mirror 核对课程日历。",
      "version": "metric-r1",
      "source_types": ["academic_mirror"],
      "can_correct": true,
      "comparison_mode": "self_only"
    },
    {
      "id": "metric-capacity",
      "label": "承诺 / 可用容量",
      "unit": "小时 / 周",
      "definition": "本人主动填写的可用时间与已承诺任务时间。",
      "purpose": "帮助调整计划，不把资源不足写成个人失败。",
      "limitation": "完全依赖本人短期自报，不从设备行为推断。",
      "correction_route": "本人可修改或删除。",
      "version": "metric-r1",
      "source_types": ["self_report"],
      "can_correct": true,
      "comparison_mode": "self_only"
    },
    {
      "id": "metric-recovery",
      "label": "恢复感受",
      "unit": "本人自报",
      "definition": "本人可选填写的短期恢复感受。",
      "purpose": "让减压动作以本人感受为依据。",
      "limitation": "不是医学或心理诊断；不提供不影响权益。",
      "correction_route": "本人可立即修改、撤回或删除。",
      "version": "metric-r1",
      "source_types": ["self_report"],
      "can_correct": true,
      "comparison_mode": "self_only"
    }
  ],
  "observations": [
    {
      "id": "obs-revision-quality",
      "metric_id": "metric-revision-quality",
      "value": 3,
      "display_value": "3 次",
      "range_label": "比本人前一窗口多 1 次",
      "period_start": "2026-07-11",
      "period_end": "2026-07-24",
      "updated_at": "2026-07-24T10:39:00+08:00",
      "expires_at": "2026-08-01T10:39:00+08:00",
      "source_ids": ["ev-revision-001", "ev-review-001"],
      "confidence": "medium",
      "confidence_reason": "事件可回放，但样本窗口只有 14 天。",
      "data_gaps": ["7 月 17 日离线学习未产生结构化修订事件。"],
      "trend": [
        {"period": "W1", "label": "6/27", "value": 1, "status": "observed"},
        {"period": "W2", "label": "7/04", "value": 2, "status": "observed"},
        {"period": "W3", "label": "7/11", "value": null, "status": "gap"},
        {"period": "W4", "label": "7/18", "value": 3, "status": "observed"},
        {"period": "W5", "label": "7/24", "value": 3, "status": "observed"}
      ]
    },
    {
      "id": "obs-source-checks",
      "metric_id": "metric-source-checks",
      "value": 5,
      "display_value": "5 次",
      "range_label": "本人近期窗口：3–5 次",
      "period_start": "2026-07-11",
      "period_end": "2026-07-24",
      "updated_at": "2026-07-24T10:39:00+08:00",
      "expires_at": "2026-08-01T10:39:00+08:00",
      "source_ids": ["ev-source-open-001", "ev-exam-source-001"],
      "confidence": "medium",
      "confidence_reason": "只计算显式打开 Evidence 的事件，不推断是否真正阅读。",
      "data_gaps": ["纸面笔记与外部阅读不在此记录。"],
      "trend": [
        {"period": "W1", "label": "6/27", "value": 2, "status": "observed"},
        {"period": "W2", "label": "7/04", "value": 3, "status": "observed"},
        {"period": "W3", "label": "7/11", "value": 3, "status": "observed"},
        {"period": "W4", "label": "7/18", "value": 4, "status": "observed"},
        {"period": "W5", "label": "7/24", "value": 5, "status": "observed"}
      ]
    },
    {
      "id": "obs-task-clarity",
      "metric_id": "metric-task-clarity",
      "value": 5,
      "display_value": "5 / 6",
      "range_label": "1 项仍缺少清晰 Done",
      "period_start": "2026-07-24",
      "period_end": "2026-07-31",
      "updated_at": "2026-07-24T11:20:00+08:00",
      "expires_at": "2026-07-25T11:20:00+08:00",
      "source_ids": ["ev-mirror-course-001", "ev-review-001"],
      "confidence": "low",
      "confidence_reason": "课程目录接近过期，且有一项要求待教师确认。",
      "data_gaps": ["工程训练任务的完成口径仍未知。"],
      "trend": [
        {"period": "D1", "label": "周一", "value": 4, "status": "observed"},
        {"period": "D2", "label": "周二", "value": 4, "status": "observed"},
        {"period": "D3", "label": "周三", "value": null, "status": "gap"},
        {"period": "D4", "label": "周四", "value": 5, "status": "observed"}
      ]
    },
    {
      "id": "obs-deadline-density",
      "metric_id": "metric-deadline-density",
      "value": 4,
      "display_value": "4 个",
      "range_label": "其中 2 个集中在 48 小时内",
      "period_start": "2026-07-24",
      "period_end": "2026-07-31",
      "updated_at": "2026-07-24T11:20:00+08:00",
      "expires_at": "2026-07-25T11:20:00+08:00",
      "source_ids": ["ev-mirror-course-001", "ev-season-deadline-001"],
      "confidence": "medium",
      "confidence_reason": "只包含当前授权课程镜像。",
      "data_gaps": ["未授权社团与个人事务不在系统中。"],
      "trend": [
        {"period": "D1", "label": "周五", "value": 1, "status": "observed"},
        {"period": "D2", "label": "周六", "value": 0, "status": "observed"},
        {"period": "D3", "label": "周日", "value": 2, "status": "observed"},
        {"period": "D4", "label": "周一", "value": 1, "status": "observed"}
      ]
    },
    {
      "id": "obs-capacity",
      "metric_id": "metric-capacity",
      "value": 34,
      "display_value": "34 / 36 小时",
      "range_label": "本人保留 2 小时缓冲",
      "period_start": "2026-07-21",
      "period_end": "2026-07-27",
      "updated_at": "2026-07-24T11:32:00+08:00",
      "expires_at": null,
      "source_ids": ["ev-self-capacity-001"],
      "confidence": "low",
      "confidence_reason": "本人自报计划，不等于实际投入。",
      "data_gaps": ["临时责任可能改变容量。"],
      "trend": [
        {"period": "W1", "label": "上周", "value": 31, "status": "observed"},
        {"period": "W2", "label": "本周", "value": 34, "status": "observed"}
      ]
    },
    {
      "id": "obs-recovery",
      "metric_id": "metric-recovery",
      "value": null,
      "display_value": "需要缓冲",
      "range_label": "本人主动填写 · 可删除",
      "period_start": "2026-07-24",
      "period_end": "2026-07-27",
      "updated_at": "2026-07-24T11:33:00+08:00",
      "expires_at": "2026-07-27T23:59:00+08:00",
      "source_ids": ["ev-self-recovery-001"],
      "confidence": "low",
      "confidence_reason": "敏感自报只描述本人当下感受，不转成分数。",
      "data_gaps": [],
      "trend": []
    }
  ],
  "abilities": [
    {
      "id": "ability-knowledge",
      "label": "知识理解",
      "observed_label": "4 / 5 次证据检查后答对",
      "description": "只描述本期有来源的理解检查。",
      "source_ids": ["ev-exam-source-001"],
      "confidence": "medium"
    },
    {
      "id": "ability-applied",
      "label": "应用与修订",
      "observed_label": "3 次可回放修订",
      "description": "展示作品行为，不折算永久能力。",
      "source_ids": ["ev-revision-001", "ev-review-001"],
      "confidence": "medium"
    },
    {
      "id": "ability-collaboration",
      "label": "协作",
      "observed_label": "数据不足，暂不展示精确值",
      "description": "没有授权同伴反馈，因此不猜测。",
      "source_ids": [],
      "confidence": "insufficient"
    },
    {
      "id": "ability-habit",
      "label": "学习习惯",
      "observed_label": "5 / 7 个计划检查点已完成",
      "description": "只比较本人近期计划，不追踪深夜在线。",
      "source_ids": ["ev-season-deadline-001"],
      "confidence": "low"
    }
  ],
  "load_signals": [
    {
      "id": "load-credits",
      "label": "课程承诺",
      "display_value": "18 学分",
      "severity": "watch",
      "text_equivalent": "课程承诺较高；不是学校正式状态。",
      "source_ids": ["ev-mirror-course-001"]
    },
    {
      "id": "load-deadlines",
      "label": "截止期限",
      "display_value": "4 个 / 7 天",
      "severity": "high",
      "text_equivalent": "未来七天四个已知任务，两个集中在四十八小时。",
      "source_ids": ["ev-season-deadline-001"]
    },
    {
      "id": "load-time",
      "label": "时间容量",
      "display_value": "34 / 36 小时",
      "severity": "high",
      "text_equivalent": "本人计划只剩两小时缓冲。",
      "source_ids": ["ev-self-capacity-001"]
    },
    {
      "id": "load-feeling",
      "label": "本人感受",
      "display_value": "需要缓冲",
      "severity": "watch",
      "text_equivalent": "本人主动填写；不是医学判断。",
      "source_ids": ["ev-self-recovery-001"]
    }
  ],
  "support_actions": [
    {
      "id": "support-plan-buffer",
      "title": "先保留缓冲",
      "action": "在试排中移动一个演示任务，释放 90 分钟。",
      "availability": "可立即预演，不修改正式课表。",
      "source_id": "ev-season-deadline-001"
    },
    {
      "id": "support-office-hour",
      "title": "带证据提问",
      "action": "整理一个来源冲突，使用课程官方人工渠道。",
      "availability": "当前只展示演示入口，真实预约时间需另行确认。",
      "source_id": "ev-support-001"
    },
    {
      "id": "support-pause",